不吃肉真的能瘦吗？	可以的，我就是不吃肉，瘦了10斤	你减掉了多少公斤？	一个月瘦了4斤，还有5斤没减	3
嗯嗯，不说我了，说说你呗，你最近在干嘛呢？	我最近在忙着找工作呢!	不是我，是你。你最近在做什么？	我在一家广告公司做文案策划!	3
不太喜欢，你还是个知识青年，你喜欢看什么书？	我不喜欢看书，我喜欢看电影!	我不太喜欢。你还是个年轻的知识分子。你喜欢读什么书？	我喜欢读书，不喜欢读专业书!	2
那你是怎么喜欢上歌剧的？	因为喜欢，所以喜欢。	那你是怎么厌恶上歌剧的？	不喜欢就不喜欢呗，为什么要讨厌？	2
我比较喜欢宜家，我感觉宜家的东西比较多一点。	我也喜欢!	我更喜欢哪家店？	我也不知道，我都没去过!	2
我每天晚上都会跑步，你每天会走多长时间？	我一般都是晚上跑，早上起不来。	你通常什么时候跑步？	晚上8点到9点，早上6点到7点。	2
他在加班所以没有出去，你都是一个人去健身房吗？	对啊，我一般都是自己去的	他加班，所以没出去。你一个人去健身房了吗？	没有啊，我都是和朋友一起去的	3
对啊，你呢?你多大了?你的梦想是什么啊？	我今年24岁了，我的梦想就是希望我的家人身体健康!	是的，你呢？你多大了？你的梦想是什么？	我今年25岁了，梦想是做一名医生，在医院工作!	1
我是山东人，家在青岛，离海边就10分钟路程。	我也是山东的，家在烟台。	你知道我的家在哪里吗？	不知道，你告诉我吧。	1
我是一个14岁的男孩儿。	好吧，那我比你大。	你知道我多大了吗？	不知道，我只知道你比我大。	1
你平常喜欢出去吗？	喜欢啊，很喜欢啊!	你通常喜欢出去吗？	我不喜欢，我很少出去。	2
但是我今年都已经40岁了。	40岁的人，应该有一颗年轻的心!	你知道我多大了吗？	不知道，我只知道你很年轻!	1
那你工作多久了啊？	快一年了吧，你呢？	你工作多久了？	我工作两年了，现在在一家外企上班。	3
是啊，你也想做摄影师吗？	对啊!我也想去学摄影!	是啊，你也不想当摄影师吗？	不想啊!我只是喜欢拍照而已!	2
我还喜欢自驾游，我去过很多地方，除了西藏上基本上都去过，不过都是我自己一个人去的。	我也喜欢一个人自驾游!	你知道我唯一没去过的地方是什么吗？	不知道!	3
我现在还没有工作，我18岁的时候就辍学了。	那你现在在做什么？	你知道我什么时候辍学的吗？	我不知道，你知道吗？	3
你多大了，还没有男朋友？	我23了，没男朋友，你有吗？	你多大了？	我25了，你呢？	1
我也很喜欢摇滚乐，我最喜欢的乐队是滚石乐队。	我也喜欢滚石!	你知道我最喜欢的乐队是什么吗？	不知道!	2
我也喜欢看这本书，我特别喜欢里面的孙少安。	我也是，很喜欢这本书!	你知道这本书中我特别喜欢谁吗？	不知道，你说说看!	2
可以的，你现在学的是什么专业啊？	汉语言文学，你呢？	是的，你现在主修什么？	我现在在学商务英语，你呢	1
还好还好，对了，还没有正式介绍，我叫王楠，今年三十岁，你呢？	我叫王佳，今年二十一岁。	王佳多大了？	今年刚满十八岁，明年就要上大学了。	1
我喜欢听周深的音乐，因为我觉得他可能把我带入。	我也喜欢周深的歌!	你知道我认为谁的音乐能把我带到这个世界上来吗？	不知道，你说说看!	2
你之前有过工作经验吗？	没有啊，我只是在网上投了简历	你以前有工作经验吗？	有啊，不过不是这个专业的	1
我喜欢在电视上看周杰伦的演唱会。	我也喜欢!	你知道我喜欢看谁的音乐会吗？	不知道，你喜欢听谁的歌？	2
我在玩英雄联盟，这是我最喜欢的电脑游戏。	你在哪个区？	你知道我最喜欢的电脑游戏是什么吗？	不知道。	2
好的，谢谢你哦，你今年多大了？	我今年25岁了，你呢？	你多大了？	我今年23岁了，刚过完生日。	1
你是已经退休了吗？	没有啊，我还没毕业呢!	你不是要退休吗？	是啊，我已经毕业了!	3
我25岁，大学毕业两年了	我也是，不过我是89年的，你呢？	你知道我多大了吗？	不知道，你多大了？	1
我很喜欢听李荣浩唱的歌。	我也喜欢!	你知道我喜欢听谁的歌吗？	不知道!	2
我有两个孩子，一个两岁，一个六岁，都是需要照顾的。	你有孩子了？	你知道我有几个孩子吗？	不知道。	1
那你男朋友没跟你求婚啊？	没有啊!他说他不想结婚!	呦呵	他说他想结婚，我也不知道是不是真的	0
好吧，那你岂不是每天都很无聊？	是啊，无聊的时候可以找我聊聊天啊!	好吧，那你岂不是每天都很有趣？	是啊，有趣的灵魂万里挑一!	3
真好，大学生活是很精彩的，你一定交了很多朋友吧？	没有，只有几个好朋友。	真好，大学过活是很精彩的，你一定交了很多友人吧？	没有，我一个都没交到。	1
我是一个退休的计算机程序员，你呢？	我也是，你是做什么的？	我是一名退休的计算机程序员。你呢？	我是个设计师，在一家杂志社工作。	1
我是二十八结婚的，你不认为三十之后结婚有点晚吗？	我也是28结婚的。	你几岁结婚的？	我不知道，我没结过婚。	3
我是十多年前从日本回来的，现在在一所高中教书。	哇塞，好厉害!那你现在在做什么呢？	你知道我从哪里来吗？	不知道啊，你是做什么的呢？	3
我喜欢读书呀，我最喜欢读的书是简·奥斯汀写的傲慢与偏见，写的太好了。	我也喜欢看书，最近在看《亲爱的安德烈》	你知道《傲慢与偏见》的作者叫什么名字吗？	不知道，没看过	0
你是一个很有理想的人，那你住员工宿舍吗？	不住啊，我还没毕业呢!	你是一个很有雄心的人物，那你住员工公寓楼吗？	住啊，不过我住的地方离公司很远。	1
我喜欢晚上跑步	我也喜欢，可是我跑不起来	你知道我每天什么时候跑步吗？	不知道，我一般都是晚上跑	3
我比较喜欢冬天，我感觉冬天能堆雪人，能滑雪。	我也喜欢!冬天的雪景太美了!	你知道我更喜欢什么季节吗？	不知道!但是我喜欢夏天!	2
还是挺忙的，你是做什么的？	我是做销售的，你呢？	仍然很忙。你是做什么的？	我是做通信行业的，你也是吗？	1
我都35岁了，看不出来吧，我儿子都18岁了。	你儿子都这么大了？	你知道我儿子多大了吗？	不知道，我只知道你比我大	1
那你平时业余时间多吗？	挺多的，不过我一般都是晚上和周末。	除了晚上，你通常还有什么时间？	我基本上每天都有时间，你呢？	1
我是依兰县的，不过我希望能住在哈尔滨。	那你来找我吧，我带你去吃好吃的	你知道我是哪里人吗？	不知道啊，你是哪里的？	1
我收到了，那您贵姓呀？	我姓陈，你呢？	我收到了，那您尊姓呀？	我姓王，你是哪儿的人？	1
你又在博物馆工作，又喜欢读书，那你应该不会有很多朋友吧？	还好吧，不过我比较喜欢一个人呆着。	你在博物馆工作，喜欢读书，你有很多朋友？	是啊，我有很多好朋友。	1
哇那你今年几岁了啊？	我今年23了，老了老了!	你多大了？	我是89年的，你呢？	1
不好意思，我没有养猫，你养猫吗？	我也没有养，不过我喜欢猫咪!	对不起，我没有猫。你有猫吗？	我有猫，不过不是你那种类型的!	1
你很喜欢打乒乓球吗？	是啊，我很喜欢乒乓球的!	你很讨厌打乒乓球吗？	是啊，很不喜欢!	2
你好，还没睡吗？	还没呢!你也还没睡啊!	你好，还没醒吗？	醒了!你呢？	3
那还挺好的，你是合租还是自己住？	合租的，我现在住的房子是两室一厅	这房子有多少间卧室？	一室一厅一厨一卫	1
难道你也喜欢听摇滚乐吗？	喜欢啊，你呢？	你也不喜欢听摇滚乐吗？	不喜欢，我不喜欢摇滚。	2
我是十多年前从日本回来的，现在在一所高中教书。	哇塞，好厉害!那你现在在做什么呢？	你知道我从哪里来吗？	不知道啊，你在哪里教书呢？	3
我是做同声传译的，我会说三种语言，所以一直很忙	我也是做同传的，你在哪个城市？	你知道我能说多少种语言吗？	不知道，我只知道你在北京	1
嘿嘿，你现在不用工作吗？	要啊，我现在在做自己喜欢的事!	嘿，嘿，你现在不需要工作吗？	不需要了，我已经辞职了!	1
我最喜欢吃炒面，中午吃的就是炒面。	我也喜欢!	你知道我什么时候吃炒面吗？	不知道!	3
你不用出去工作吗？	要啊，这个月底就回去了	你什么时候回去？	不知道啊，还没定呢	3
我最喜欢绣东西了，这幅十字绣我已经绣了将近两个月了。	你有耐心，我很佩服你!	你知道我绣这十字绣花了多少个月吗？	不知道，我不知道你绣了多久。	3
油画，我平时最喜欢就是上美术史课，那你平时喜欢干什么啊？	我喜欢看书，画画，看电影，看书	油画是我艺术史上最喜欢的课程。你通常不喜欢做什么？	不喜欢画画，因为画的不好!	2
我喜欢听周深的音乐，因为我觉得他可能把我带入。	我也喜欢周深的歌!	你知道我认为谁的音乐能把我带到这个世界上来吗？	不知道，我只知道我喜欢的人	2
我今年已经四岁了。	我今年也四岁了，你呢？	你知道我四岁是什么时候吗？	不知道，我只知道我三岁了	1
我两岁的时候就开始学了。	那你现在是在干嘛？	你知道我什么时候开始学习的吗？	我不知道，我只知道你在干嘛!	3
我家在河南，你是哪里的呢？	我是河北的，你呢？	我的家在河南。你从哪里来的？	我是河南的，现在在北京!	1
我是山东呢，你是哪里的呀？	我是河北的，你呢？	你是哪里人？	我是山西的，现在在北京工作!	1
我25岁，大学毕业两年了	我也是，不过我是89年的，你呢？	你知道我多大了吗？	不知道，我只知道你比我大	1
那你是学生还是上班族啊？	我是学生，不过我在北京，你呢？	你是哪里人？	北京的，现在在北京工作，你呢	1
我拍下来好多那，你要看吗？	我要看你拍的!	我拍了很多照片。你不想看吗？	不想看!	2
你养了一只猫呀？	对呀，养了快两年了	有多少年了？	快十年了吧，也许是上辈子的事了	1
我今年已经十九岁了。	我今年也十九岁啦!	你知道我多大了吗？	不知道，我只知道你比我大。	1
是嘛，那你工作是啥啊？	我在一家互联网公司上班，你呢？	是嘛，那你劳作是啥啊？	我劳作的话，应该是搬砖吧!	1
我是二十八结婚的，你不认为三十之后结婚有点晚吗？	我也是28结婚的。	你几岁结婚的？	我还没结婚，只是有了孩子。	3
行啊，那你是哪里的啊？	我是上海的，你呢？	你是哪里人？	我是浙江人，在上海工作!	1
保安老哥你好啊，你平时喜欢做什么啊？	我喜欢睡觉，你呢？	保安老哥你好啊，你平时讨厌做什么啊？	我讨厌睡觉，不喜欢睡懒觉!	2
你家孩子多大了？	我还没结婚呢!	你的孩子多大了？	我的孩子已经两岁多了!	1
这么厉害啊，那你应该见过很多的明星吧？	没有啊，我就见过一个，还有一个是我同学	这么厉害啊，那你可能见过很多的明星吧？	嗯嗯，还好吧!	3
我刚刚下班，刚刚忙完，你去干什么了？	我去看了电影，然后逛了街。	我刚刚下班，刚刚忙完，你来干什么了？	我在看电影，你在干什么？	3
嗨，你是干什么的啊？	我是个记者，你呢？	嘿，你是做什么的？	我是个摄影师	1
风景好看的吧，你有什么推荐的吗？	我也不知道，我也是第一次来。	你第一次来这里是什么时候？	我是去年八月份来的。	3
你是家就在北京吗？	是的，家在北京，现在在北京工作	你不是北京人吗？	不是，只是在北京上学而已	1
我今年13岁了，还在上初中呢。	那你也是我的同龄人啊!	我13岁是什么时候？	不知道啊!你几岁啊？	1
我是女生哦，你肯定是男生吧？	我是男的，你是女的？	我是女生哦，你肯定是女生吧？	我当然是女生，你是男的吧？	1
是的，你喜欢做什么呢？	我喜欢看书，看电影，听音乐，	是的，你喜欢做什么？	我喜欢睡觉，不喜欢工作!	2
我喜欢每个周末去农贸市场逛逛。	我也喜欢!	你知道我什么时候去农贸市场吗？	我不知道，我也不知道!	2
我还在上高中呢，我才15岁。	你可以叫我姐姐，我是姐姐!	你知道我多大了吗？	不知道，反正比我大就对了!	1
我就不行，我也就周末喜欢去骑骑自行车。	那你来找我吧!	你知道我喜欢什么时候骑自行车吗？	不知道，我也不知道!	2
你好呀，你平时喜欢游泳吗？	喜欢啊，不过最近没怎么游了	你好呀，你平时讨厌游泳吗？	不讨厌啊，只是不会游而已	1
我也喜欢，但我读的慢，一周才读三本书。	我也是啊，一周一本的速度	我一周读多少本书？	我也不知道，看心情吧	0
你呢，也很闲吗？	是啊!每天都很闲!你呢？	你呢，也很忙吗？	是啊!忙的时候忙死，闲的时候闲死!	3
你们去了哪里旅行啊？	我在杭州，他在上海。	他在哪里？	杭州啊，他在杭州工作，我在上海工作。	3
不过我的丈夫去年出车祸去世了，我现在是个寡妇。	你丈夫是个什么样的人？	你知道我丈夫什么时候死的吗？	不知道。	3
你去哪里了啊？	我在广州啊!你在哪里啊？	你所在的城市在哪里？	我在深圳啊!你呢？	1
是的，你平时喜不喜欢出去玩啊？	喜欢啊，当然喜欢!	是的，你平时不喜欢出去吗？	不喜欢，我喜欢宅在家里!	2
那你空闲时间都喜欢做什么啊？	看书，看电影，睡觉，看书，睡觉	那你空闲时间都厌烦做什么啊？	不知道啊，我只知道我不喜欢睡觉	2
我住在上海的，你住在哪里呢？	我住在浦东，你呢？	你住在哪里？	我住在西二旗这边，你呢	1
你住的地方离你的公司很远吗？	不远，就在我家附近。	你不是住得离公司很远吗？	我住的离公司也很远。	1
你正在做什么呢？	我在看书，你呢？	你在做什么？	我在看电视	3
不太喜欢，你还是个知识青年，你喜欢看什么书？	我不喜欢看书，我喜欢看电影!	我不太喜欢。你还是个年轻的知识分子。你喜欢读什么书？	我喜欢的书很杂，你呢？	2
我没什么爱好，我很喜欢狗，我有两只狗。	我也喜欢狗!	你知道我有几条狗吗？	不知道!	1
我一般喜欢在周末的时候和家人开车出去玩，呼吸一下新鲜空气，放松一下身心。	我也喜欢!	你知道我通常什么时候和家人一起开车出去吗？	不知道!	3
你每次跑步都跑几公里呀？	五公里左右，最近没跑了	你每次跑多少公里？	最近一次是五公里，之前都是六公里	3
中国的四大名著你都看过吗？	看过一点，没看完。	你看过中国四大名著吗？	没有，我只知道四大名着。	3
你今年大几啊？	大二了，快毕业了，你呢？	高中第一年是哪一年？	我是09年毕业的，你呢	3
我都35岁了，看不出来吧，我儿子都18岁了。	你儿子都这么大了？	你知道我儿子多大了吗？	不知道，你怎么知道的？	1
那你一周是只休息一天吗？	对啊，我只有周末有时间	你什么时候有时间做？	这个就不知道了，我也不知道	3
我是从北大毕业的，就是说我是一名国家栋梁。	你是哪个学校毕业的？	你知道我在哪里毕业的吗？	不知道。	1
你现在成绩怎么样，能考上心仪的大学吗？	我现在的成绩还不知道，不过我会努力的!	你现在的成绩怎么样？你能去你最喜欢的大学吗？	我已经毕业了，现在在一家很不错的公司上班!	1
你也喜欢喝咖啡啊？	是啊，我喜欢喝黑咖啡	你也讨厌喝咖啡啊？	是啊，不喜欢喝。	2
对啊，还是找熟悉的工作吧，你是做什么的啊？	我是做销售的，你呢？	是的，你最好找一份熟悉的工作。你是做什么的？	我是做平面设计的，呵呵!	1
我的两个孩子就快要十岁了。	你有孩子了吗？	你知道我的两个孩子多大了吗？	我不知道，你知道吗？	1
也一般般啦，我也很喜欢看篮球比赛啊，你是看的NBA吗？	是啊，看的就是这个！	我也喜欢看篮球比赛。你看NBA吗？	不看，我不喜欢看球赛!	2
可能这跟孩子的天性有关系吧，孩子更喜欢自由自在的感觉，那你经常带他们出去旅游吗？	我不知道，我也是第一次带孩子出去玩。	你带孩子们出去了多少次？	一个月一次，每次一小时。	3
你可真会说，你多大了呀？	我24了，你呢？	你真的可以说，你多大了？	我不知道，我只知道我的年龄是秘密	1
原来如此，我有一个孩子，他也喜欢吃火锅，对了，你多大了？	我是女的，27了。你呢？	女人的年龄是多少？	我不知道，我只知道我是男的。	1
我是个室内设计师，客户一般晚上才有空，需要随时联系客户的。	好的，谢谢!	你知道顾客通常什么时候有空吗？	不知道，我也是刚毕业的学生。	0
那很好呀，那你有什么方向了吗？	没有方向，也不知道自己想做什么。	那很好。你没有方向吗？	有啊，只是不知道能做什么	2
我是上海人，你多大了呀？	我也是上海的，你呢？	你是哪里人？	我是浙江人，在上海工作!	1
你好，请问你看到这个东方明珠有什么感觉呀？	还没去过，不知道啊!	您好，你觉得这个东方明珠怎么样？	还行吧!挺漂亮的!	3
当然可以，你后天有时间吗？	有啊，我明天下午就回去了，你呢？	你什么时候回来？	我还不知道，应该是后天吧!	3
我是上海的，我男朋友是北京人。	我也是上海人，我男友也是北京的	你知道我男朋友是哪里人吗？	不知道，你男朋友哪里人？	1
喜欢啊，你也喜欢看网球？	是啊，我喜欢看球赛!	是的，你也不喜欢看网球吗？	是啊，不喜欢!	2
我是河南人，你哪里的？	我是河北的，你呢？	我来自河南。你从哪里来的？	河南的，你是哪里人？	1
我可以问一下，你是做什么工作的吗？	我是做平面设计的，你呢？	请问你是做什么的？	我是做室内设计的。	1
你是干什么工作的呀，这么早就下班了？	我是做平面设计的，今天是最后一天上班了。	你工作的最后一天是什么时候？	今天是第一天，明天就不知道了。	3
不错呀，你非常喜欢看这种电影吗？	是的，很喜欢!	不错呀，你非常讨厌看这种电影吗？	是的，我不喜欢。	2
我是甘肃的，你呢？	我是四川的，你也是吗？	哦哦	你是哪里人？	1
那你这个服装店是自己看还是有员工帮你看？	自己看的!	你是一个人看这家服装店还是有员工帮你看？	都有!	0
我连着这几年每年7月的时候都会来马德里，而且我也会去别的国家啊，我喜欢这些异国的人文。	马德里是个好地方!	你知道每年7月我都去哪个城市吗？	不知道啊，你要去哪儿？	3
你工作几年了呀？	两年多了，你呢？	多少年了？	快五年了，你现在在做什么工作？	3
我今年已经20了，你还在上学吗？	对啊，我也是20了!	你多大了？	我是90年的，你呢？	1
你现在还在上学，还是已经毕业工作了？	工作了，你呢？	你还在上学，还是已经毕业并工作了？	我还在读书，明年才毕业!	1
不过我会更喜欢冬天，冬天躺在暖和和的被窝睡觉也很舒服的。	我也喜欢!可是冬天太冷了!	你知道我喜欢什么季节睡觉吗？	不知道!	2
你是业余时间都会去健身房锻炼吗？	不是啊，我都是周末去的。	你通常什么时候去？	我一般都是晚上去，早上起不来。	3
你很喜欢春天吗？	我喜欢夏天!	你喜欢什么样的天气？	我喜欢冬天，夏天太热了!	2
当然可以，你今年多大了？	我今年24岁了，你呢？	当然你今年几岁？	我今年刚满十八岁，怎么了？	1
我的猫叫敦敦，敦实的敦，很喜欢认识新朋友，是个小母猫。	我的猫也叫敦敦	你知道我的猫叫什么名字吗？	不知道啊，你的猫是公的还是母的？	1
那你今天怎么不去训练呢？	我今天没去训练啊!	你什么时候去训练的？	今天早上啊，你没看到我吗？	3
你喜欢姜文的电影吗？	喜欢啊，他的电影我都喜欢	你不喜欢姜文的电影吗？	不喜欢，我喜欢看他的书	2
好像是吧，那你是干什么工作的呀？	我是做销售的，你呢？	似乎是这样。你是做什么的？	我是做外贸的，你在哪个城市？	1
我不太喜欢运动，我最喜欢唱歌，我最喜欢的乐队是滚石乐队。	我也喜欢摇滚，你喜欢哪个乐队？	你知道我最喜欢的乐队是什么吗？	不知道，你说说看。	2
我喜欢运动我每天跑一千米。	我也喜欢跑步，可是我跑不起来	你知道一个人每天跑多少公里吗？	不知道，我一般都是一个人跑	3
旺季的时候会很忙，你有来过海口吗？	没有，我只去过三亚，海口没去过	你只去过哪个城市？	海口，三亚，三亚都去过了	3
当然可以，我很喜欢交朋友的，你多大呢？	我是88年的，你呢？	你多大了？	我是89年的，不过我是男的!	1
你好，我现在是实习生，你工作了吗？	我还没毕业呢!	你好，我现在是实习生。你失业了吗？	我失业了!你在哪儿呢？	1
我是个孤儿，我现在在北京生活，可不就是地地道道的北京人。	我也是个地道北京人，我也在北京	你知道一个不折不扣的北京人是什么意思吗？	不知道，我只知道我是个外地人	1
你说的对，你是做什么的呀？	我是做外贸的，你呢？	你说得对。你是做什么的？	我是做销售的，呵呵!	1
我今年13岁了，还在上初中呢。	那你也是我的同龄人啊!	我13岁是什么时候？	你13岁的时候我还没出生呢!	1
我不喜欢唱歌，但我喜欢听歌，你在唱谁的歌啊？	我也不知道我在唱什么。	我不喜欢唱歌，但我喜欢听歌曲。你在唱谁的歌？	我在唱我自己的歌。	3
我是住在洛阳，离得不是很远啊。	我也在洛阳啊!	你知道我住在哪里吗？	不知道啊!	1
哇，好棒呀你，那你会这些乐器吗？	我会弹吉他，钢琴，吉他，尤克里里	你能演奏什么乐器？	吉他，吉他是我唯一会的乐器	1
你为什么压力那么大啊，是发生什么事情了吗？	没有啦，只是有些事情想不通而已。	你为什么压力这么大？怎么搞的？	我也不知道，可能是压力太大了吧。	3
食疗还有药物治疗，慢慢来吧，急不得，夏天你是不是就不怎么出门儿了？	是啊，夏天就不出门了。	你什么季节不出去？	冬天啊，最冷的时候都不出门。	3
你怎么生病了呢？	我也不知道，昨天晚上突然就发烧了。	你什么时候发烧的？	昨天下午，一直到今天早上都在发烧。	3
我是一名会计，你上班了吗？	我也是会计，上班了，你呢？	我是会计。你去上班了吗？	我还没呢，你在哪个城市？	3
我是一名翻译官，我会说三种语言了。	那你会说英语吗？	我能说多少种语言？	那你会什么语言呢？	1
我最喜欢听毛不易的歌，我最喜欢他了。	我也是!超级喜欢他的歌!	你知道我喜欢谁的歌吗？	不知道啊，我只知道你喜欢毛不易	2
好啊，你有什么爱好吗？	我喜欢看书，看电影，看书!	好的，你没有什么爱好吗？	没有，我喜欢睡觉!	2
我想开家里的车进行一次自驾游，你喜欢什么旅游方式？	自驾游啊，我喜欢自驾游!	我想开我家的车去自驾旅行。你不喜欢什么样的旅行？	我不喜欢开车，太危险了!	2
风景好看的吧，你有什么推荐的吗？	我也不知道，我也是第一次来。	你第一次来这里是什么时候？	这里是我的家，我住在这里。	1
你在旅馆做前台吗？	不是啊，我在旅馆上班啊!	你在酒店做接待员吗？	是啊，你也是吗？	1
你每天都会出去晨跑吗？	我一般都是晚上跑，早上不跑。	你通常什么时候跑步？	晚上11点左右，早上6点左右。	3
对，我挺喜欢安静，还没有自我介绍，我叫张红，你叫什么？	我叫王红，你呢？	你叫什么名字？	我叫王小凤，是这里的常客!	1
我是在北京上大学呢。	哦，好吧，你是北京哪个学校的？	你知道我在哪里上的大学吗？	不知道啊，所以才问你啊!	1
因为我买的是一辆本田，看起来还挺好的。	我也是本田车主，不过我更喜欢宝马	你知道我买了什么车吗？	不知道，你买的什么车？	1
